{
  "$schema": "http://json-schema.org/draft-07/schema#",
  "title": "Output schema",
  "description": "",
  "type": "array",
  "items": {
    "type": "object",
    "properties": {
        "songName": {
          "type": "string"
        },
        "songDuration": {
          "type": "integer"
        },
        "recordName": {
          "type": "string"
        },
        "recordGenre": {
          "type": "string",
          "enum": [
            "ROCK",
            "POP",
            "DANCE"
          ]
        },
        "recordType": {
          "type": "string",
          "enum": [
            "SINGLE",
            "EP",
            "ALBUM"
          ]
        },
        "recordReleaseDate": {
          "type": "integer",
          "format": "int64"
        },
        "artistName": {
          "type": "string"
        }
    },
    "required": ["songName", "songDuration", "recordName", "recordGenre", "recordType", "recordReleaseDate", "artistName"]
  }
}
  